{
  "$schema": "https://json-schema.org/draft/2020-12/schema",
  "$id": "https://metaviewer.local/contracts/v0.2/action_proposal.schema.json",
  "title": "Action Proposal",
  "type": "object",
  "properties": {
    "schema": {
      "const": "action_proposal/v0.2"
    },
    "proposal_id": {
      "type": "string",
      "minLength": 1,
      "maxLength": 128
    },
    "surface_id": {
      "type": "string",
      "minLength": 1,
      "maxLength": 128
    },
    "based_on_frame": {
      "type": "object",
      "properties": {
        "sha256": {
          "type": "string",
          "pattern": "^[0-9a-f]{64}$",
          "maxLength": 65536
        },
        "generation": {
          "type": "integer",
          "minimum": 1,
          "maximum": 9007199254740991
        }
      },
      "required": [
        "sha256",
        "generation"
      ],
      "additionalProperties": false,
      "maxProperties": 256
    },
    "action": {
      "oneOf": [
        {
          "type": "object",
          "properties": {
            "type": {
              "const": "click"
            },
            "x": {
              "type": "integer",
              "minimum": 0,
              "maximum": 9007199254740991
            },
            "y": {
              "type": "integer",
              "minimum": 0,
              "maximum": 9007199254740991
            },
            "button": {
              "type": "string",
              "enum": [
                "left",
                "middle",
                "right"
              ],
              "maxLength": 65536
            }
          },
          "required": [
            "type",
            "x",
            "y",
            "button"
          ],
          "additionalProperties": false,
          "maxProperties": 256
        },
        {
          "type": "object",
          "properties": {
            "type": {
              "const": "key"
            },
            "keys": {
              "type": "array",
              "items": {
                "type": "string",
                "minLength": 1,
                "maxLength": 65536
              },
              "minItems": 1,
              "maxItems": 4096
            }
          },
          "required": [
            "type",
            "keys"
          ],
          "additionalProperties": false,
          "maxProperties": 256
        },
        {
          "type": "object",
          "properties": {
            "type": {
              "const": "type"
            },
            "text": {
              "type": "string",
              "minLength": 1,
              "maxLength": 65536
            }
          },
          "required": [
            "type",
            "text"
          ],
          "additionalProperties": false,
          "maxProperties": 256
        },
        {
          "type": "object",
          "properties": {
            "type": {
              "const": "scroll"
            },
            "dx": {
              "type": "integer",
              "maximum": 9007199254740991,
              "minimum": -9007199254740991
            },
            "dy": {
              "type": "integer",
              "maximum": 9007199254740991,
              "minimum": -9007199254740991
            }
          },
          "required": [
            "type",
            "dx",
            "dy"
          ],
          "additionalProperties": false,
          "maxProperties": 256
        },
        {
          "type": "object",
          "properties": {
            "type": {
              "const": "wait"
            },
            "ms": {
              "type": "integer",
              "minimum": 1,
              "maximum": 3600000
            }
          },
          "required": [
            "type",
            "ms"
          ],
          "additionalProperties": false,
          "maxProperties": 256
        },
        {
          "type": "object",
          "properties": {
            "type": {
              "const": "lane_submit"
            },
            "verb": {
              "type": "string",
              "minLength": 1,
              "maxLength": 128
            },
            "payload": {
              "type": "object",
              "properties": {
                "nonce": {
                  "type": "string",
                  "minLength": 1,
                  "maxLength": 128
                },
                "seq": {
                  "type": "integer",
                  "minimum": 1,
                  "maximum": 9007199254740991
                },
                "command": {
                  "type": "string",
                  "minLength": 1,
                  "maxLength": 128
                },
                "args": {
                  "type": "array",
                  "items": {
                    "type": "string",
                    "maxLength": 65536
                  },
                  "maxItems": 4096
                }
              },
              "required": [
                "nonce",
                "seq",
                "command",
                "args"
              ],
              "additionalProperties": false,
              "maxProperties": 256
            }
          },
          "required": [
            "type",
            "verb",
            "payload"
          ],
          "additionalProperties": false,
          "maxProperties": 256
        }
      ]
    },
    "expectation": {
      "oneOf": [
        {
          "type": "object",
          "properties": {
            "type": {
              "const": "changed_region"
            },
            "bbox": {
              "type": "object",
              "properties": {
                "x": {
                  "type": "integer",
                  "minimum": 0,
                  "maximum": 9007199254740991
                },
                "y": {
                  "type": "integer",
                  "minimum": 0,
                  "maximum": 9007199254740991
                },
                "w": {
                  "type": "integer",
                  "minimum": 1,
                  "maximum": 16384
                },
                "h": {
                  "type": "integer",
                  "minimum": 1,
                  "maximum": 16384
                }
              },
              "required": [
                "x",
                "y",
                "w",
                "h"
              ],
              "additionalProperties": false,
              "maxProperties": 256
            }
          },
          "required": [
            "type",
            "bbox"
          ],
          "additionalProperties": false,
          "maxProperties": 256
        },
        {
          "type": "object",
          "properties": {
            "type": {
              "const": "element_state"
            },
            "role": {
              "type": "string",
              "minLength": 1,
              "maxLength": 128
            },
            "name": {
              "type": "string",
              "maxLength": 65536
            },
            "state": {
              "type": "string",
              "minLength": 1,
              "maxLength": 128
            }
          },
          "required": [
            "type",
            "role",
            "name",
            "state"
          ],
          "additionalProperties": false,
          "maxProperties": 256
        },
        {
          "type": "object",
          "properties": {
            "type": {
              "const": "state_sha256_change"
            },
            "before": {
              "type": "string",
              "pattern": "^[0-9a-f]{64}$",
              "maxLength": 65536
            },
            "min_tick": {
              "type": "integer",
              "minimum": 0,
              "maximum": 9007199254740991
            },
            "max_tick": {
              "type": "integer",
              "minimum": 0,
              "maximum": 9007199254740991
            }
          },
          "required": [
            "type",
            "before",
            "min_tick",
            "max_tick"
          ],
          "additionalProperties": false,
          "maxProperties": 256
        },
        {
          "type": "object",
          "properties": {
            "type": {
              "const": "text_present"
            },
            "text": {
              "type": "string",
              "minLength": 1,
              "maxLength": 65536
            }
          },
          "required": [
            "type",
            "text"
          ],
          "additionalProperties": false,
          "maxProperties": 256
        }
      ]
    },
    "budget": {
      "type": "object",
      "properties": {
        "max_ms": {
          "type": "integer",
          "minimum": 1,
          "maximum": 3600000
        },
        "max_retries": {
          "type": "integer",
          "minimum": 0,
          "maximum": 10
        }
      },
      "required": [
        "max_ms",
        "max_retries"
      ],
      "additionalProperties": false,
      "maxProperties": 256
    }
  },
  "required": [
    "schema",
    "proposal_id",
    "surface_id",
    "based_on_frame",
    "action",
    "expectation",
    "budget"
  ],
  "additionalProperties": false,
  "maxProperties": 256
}
