{
  "schema": "action_proposal/v0.2",
  "proposal_id": "x",
  "surface_id": "x",
  "based_on_frame": {
    "sha256": "0000000000000000000000000000000000000000000000000000000000000000",
    "generation": 1
  },
  "action": {
    "type": "click",
    "x": 0,
    "y": 0,
    "button": "left"
  },
  "expectation": {
    "type": "state_sha256_change",
    "before": "0000000000000000000000000000000000000000000000000000000000000000",
    "min_tick": 0,
    "max_tick": 0
  },
  "budget": {
    "max_ms": 1,
    "max_retries": 0
  }
}
